{
  "adapter_version": "1.0.0",
  "mode": "provisional",
  "plan_id": "827fcce4db38cf9b296bbf8e3b64fb80ed396a87d928407da7314dc02d7636f0",
  "profile_sha256": "be2a2e1572fa1f50387c2ad6426e70a7df4fea319159e325bef3a61e3989a6eb",
  "profile_version": "1.0.0-alpha.1",
  "repository": "egohygiene/holon",
  "repository_profile": "library-cli",
  "request_sha256": "157d7d3f85ce793621b15095a77eb4f35b846b720ef8edf1260b3d1402807bf0",
  "rollback_manifest": ".holon/repository-continuity-backups/827fcce4db38cf9b296bbf8e3b64fb80ed396a87d928407da7314dc02d7636f0/attempt-001/rollback.v1.json",
  "rollback_sha256": "4ed76c30b6a9281941e35bd77fbf784161e85d78bbdd66352b8d74000b4e657c",
  "rollout_stage": "observe",
  "schema_version": "holon.repository-continuity-state/v1",
  "source_contracts": [
    {
      "artifacts": [
        {
          "id": "repository-context-contract",
          "kind": "contract",
          "path": "contracts/repository-context.toml",
          "sha256": "d8eb450bc9532d80050261cf0bd7ca3b0a614a1aad5c2dac53808b7bd146ee8c",
          "url": "https://github.com/egohygiene/hygiene/blob/43386f5749116717585ead7459b4945e0ac50d06/contracts/repository-context.toml"
        },
        {
          "id": "repository-context-schema",
          "kind": "schema",
          "path": "schemas/repository-context.v2.schema.json",
          "sha256": "e005216e7d15191f6d7017b4471bcd7380ff40412af51c0aa516a65bdf39c057",
          "url": "https://github.com/egohygiene/hygiene/blob/43386f5749116717585ead7459b4945e0ac50d06/schemas/repository-context.v2.schema.json"
        },
        {
          "id": "repository-continuity-policy",
          "kind": "policy",
          "path": "catalog/repository-continuity-policy.json",
          "sha256": "a17178482d67e141009b07d6715727612fbf7f372be8c471a124149752c2ca64",
          "url": "https://github.com/egohygiene/hygiene/blob/43386f5749116717585ead7459b4945e0ac50d06/catalog/repository-continuity-policy.json"
        },
        {
          "id": "repository-continuity-policy-schema",
          "kind": "schema",
          "path": "schemas/repository-continuity-policy.v1.schema.json",
          "sha256": "287bd030dcff2a3340475e4a7f8fd63e42f5ea4ff557d8f539e067eb8f0050d9",
          "url": "https://github.com/egohygiene/hygiene/blob/43386f5749116717585ead7459b4945e0ac50d06/schemas/repository-continuity-policy.v1.schema.json"
        }
      ],
      "id": "hygiene-continuity",
      "lifecycle": "proposed",
      "release_included": false,
      "repository": "egohygiene/hygiene",
      "revision": "43386f5749116717585ead7459b4945e0ac50d06",
      "role": "organization-policy",
      "version": "1.0.0-alpha.1"
    },
    {
      "artifacts": [
        {
          "id": "claude-repository-instructions",
          "kind": "provider-projection",
          "path": "dist/claude/repository/CLAUDE.md",
          "sha256": "3d7d433db8d3c8cf6d790ff3bcb23e9640493242a20bdabf14d2ad330db079f2",
          "url": "https://github.com/egohygiene/aether/blob/b7597301c4d22a9bcd580967b5753138bb368111/dist/claude/repository/CLAUDE.md"
        },
        {
          "id": "codex-repository-instructions",
          "kind": "provider-projection",
          "path": "dist/codex/repository/AGENTS.md",
          "sha256": "370ad8291f7601459e12390b48942deffaf82b0acc3557029986035f3081c506",
          "url": "https://github.com/egohygiene/aether/blob/b7597301c4d22a9bcd580967b5753138bb368111/dist/codex/repository/AGENTS.md"
        },
        {
          "id": "continuity-dispositions",
          "kind": "disposition-catalog",
          "path": "library/organization/instructions/repository-continuity/continuity-dispositions.v1.json",
          "sha256": "73577902d9bdd2ae5634820c49385ab630c266770f0d5b90c9b1295820e24946",
          "url": "https://github.com/egohygiene/aether/blob/b7597301c4d22a9bcd580967b5753138bb368111/library/organization/instructions/repository-continuity/continuity-dispositions.v1.json"
        },
        {
          "id": "continuity-template",
          "kind": "template",
          "path": "library/organization/skills/methodology/maintain-repository-continuity/templates/CONTINUITY.template.md",
          "sha256": "494de90d0c344db9ff41b78998445b9e9c02f23a69c25d48442d2af1de1343f2",
          "url": "https://github.com/egohygiene/aether/blob/b7597301c4d22a9bcd580967b5753138bb368111/library/organization/skills/methodology/maintain-repository-continuity/templates/CONTINUITY.template.md"
        },
        {
          "id": "github-copilot-instructions",
          "kind": "provider-projection",
          "path": "dist/github/repository/.github/copilot-instructions.md",
          "sha256": "ff5155ea4a05a4ba46a768103648be3d01d294745c755fa88148287221307ed1",
          "url": "https://github.com/egohygiene/aether/blob/b7597301c4d22a9bcd580967b5753138bb368111/dist/github/repository/.github/copilot-instructions.md"
        },
        {
          "id": "maintain-repository-continuity",
          "kind": "skill",
          "path": "library/organization/skills/methodology/maintain-repository-continuity/SKILL.md",
          "sha256": "1746b29afa62d7a523d87675430730553079e82cf42e46a6ebe7cf8c82d29e8b",
          "url": "https://github.com/egohygiene/aether/blob/b7597301c4d22a9bcd580967b5753138bb368111/library/organization/skills/methodology/maintain-repository-continuity/SKILL.md"
        },
        {
          "id": "repository-continuity-instruction",
          "kind": "instruction",
          "path": "library/organization/instructions/repository-continuity/INSTRUCTION.md",
          "sha256": "dc2fb66bd5268af2416389fef469d2a13c91d1a6f179e6fc10a21d4f890876a8",
          "url": "https://github.com/egohygiene/aether/blob/b7597301c4d22a9bcd580967b5753138bb368111/library/organization/instructions/repository-continuity/INSTRUCTION.md"
        },
        {
          "id": "repository-continuity-schema",
          "kind": "schema",
          "path": "catalog/schemas/aether.repository-continuity.v1.schema.json",
          "sha256": "a725e004fe0db2bf96a968c6e3f300d37ecf8b00b9a0923be5c5f4c529655916",
          "url": "https://github.com/egohygiene/aether/blob/b7597301c4d22a9bcd580967b5753138bb368111/catalog/schemas/aether.repository-continuity.v1.schema.json"
        },
        {
          "id": "repository-continuity-specification",
          "kind": "specification",
          "path": "library/organization/specs/methodology/repository-continuity.spec.md",
          "sha256": "362b7040a0c3dba3477d37edd641d3bf8fab9a447808d262c9576346eae93dae",
          "url": "https://github.com/egohygiene/aether/blob/b7597301c4d22a9bcd580967b5753138bb368111/library/organization/specs/methodology/repository-continuity.spec.md"
        }
      ],
      "id": "aether-continuity",
      "lifecycle": "draft",
      "release_included": false,
      "repository": "egohygiene/aether",
      "revision": "b7597301c4d22a9bcd580967b5753138bb368111",
      "role": "portable-contract",
      "version": "1.0.0"
    },
    {
      "artifacts": [
        {
          "id": "repository-continuity-report-schema",
          "kind": "report-schema",
          "path": "schemas/repository-continuity-report.schema.json",
          "sha256": "fc9d7c1a9175209e0c958cf74dded0cb974ff86c7d46130e7a7ae731f0147276",
          "url": "https://github.com/egohygiene/egolint/blob/786f1b3c59748a66bb092cad9589640f01c5b41d/schemas/repository-continuity-report.schema.json"
        },
        {
          "id": "repository-continuity-rule-catalog",
          "kind": "rule-catalog",
          "path": ".config/rules/repository-continuity.v1.toml",
          "sha256": "c4a9bb056526d0176428b47167fd5b4b29ad1803ef1f53b223c43adf4b186528",
          "url": "https://github.com/egohygiene/egolint/blob/786f1b3c59748a66bb092cad9589640f01c5b41d/.config/rules/repository-continuity.v1.toml"
        },
        {
          "id": "repository-continuity-schema",
          "kind": "schema",
          "path": "schemas/repository-continuity.schema.json",
          "sha256": "cf865611886602765a5c56efc89b2910c1bbdde3d75c7668c5e9cdcea994848b",
          "url": "https://github.com/egohygiene/egolint/blob/786f1b3c59748a66bb092cad9589640f01c5b41d/schemas/repository-continuity.schema.json"
        }
      ],
      "id": "egolint-continuity",
      "lifecycle": "proposed",
      "release_included": false,
      "repository": "egohygiene/egolint",
      "revision": "786f1b3c59748a66bb092cad9589640f01c5b41d",
      "role": "validator",
      "version": "0.1.0-alpha.1"
    }
  ],
  "surfaces": [
    {
      "adapter_owner": "egohygiene/holon",
      "applied_file_sha256": "094230e1097cbf3cd01a5b04a784b04b964f306a4fd659bc0269e40fa45358aa",
      "managed_block_sha256": "3f27461fea76eb0519c2d5021d0f8a3292e53d4bae5f28a7e715553a9662dfea",
      "owner": "consumer-repository",
      "path": "AGENTS.md",
      "source": {
        "artifact": "codex-repository-instructions",
        "lifecycle": "draft",
        "path": "dist/codex/repository/AGENTS.md",
        "release_included": false,
        "repository": "egohygiene/aether",
        "revision": "b7597301c4d22a9bcd580967b5753138bb368111",
        "role": "portable-contract",
        "sha256": "370ad8291f7601459e12390b48942deffaf82b0acc3557029986035f3081c506",
        "version": "1.0.0"
      },
      "source_usage": "managed-block",
      "strategy": "managed-block"
    },
    {
      "adapter_owner": "egohygiene/holon",
      "applied_file_sha256": "105c52f95eaae6e34dd82b883638f0f49de6f15a699912683dd979a99f81a608",
      "managed_block_sha256": null,
      "owner": "consumer-repository",
      "path": "CONTINUITY.md",
      "source": {
        "artifact": "continuity-template",
        "lifecycle": "draft",
        "path": "library/organization/skills/methodology/maintain-repository-continuity/templates/CONTINUITY.template.md",
        "release_included": false,
        "repository": "egohygiene/aether",
        "revision": "b7597301c4d22a9bcd580967b5753138bb368111",